nombre,whatsapp,email,provincia,website,telefonos_extra,emails_extra
Contacto,+506,info@viveromagiaverde.com,San José,https://vivero.cr/contacto/,,
Directorio Telefónico de Costa Rica,,,San José,https://cr.eldirectorio.co/,,
Páginas Blancas Costa Rica,+506,,San José,https://costaricatelefonos.com/paginas_blancas.htm,,
Guía Telefónica de Costa Rica,,,San José,https://www.abctelefonos.com/indice_costarica/,,
Escribanos,+506,info@te-contacto.com,San José,https://www.te-contacto.com/page3.html,,
Ofertas,+506,info@viveromagiaverde.com,San José,https://vivero.cr/ofertas/,,
Barrio Chino Donde Comprar Flores ArtificialCostaRica| TikTok,,,San José,https://www.tiktok.com/discover/barrio-chino-donde-comprar-flores-artificial-costa-rica,,
"Current Local Time inSanJose,CostaRica",,,San José,https://www.timeanddate.com/worldclock/costa-rica/san-jose,,
"CostaRica:SanJosé, intérêts touristiques et culturels",,,San José,https://costarica-nature.org/FRANCAIS/infos_touristiques_Costa_Rica/que_voir_que_faire/Sanjose.htm,,
CostaRicael mejor lugar para viajar después del Corona Virus,+506,info@costaricadentalteam.com,San José,https://costaricadentalteam.com/es/costa-rica-el-mejor-lugar-para-visitar-despues-de-la-pandemia/,,
Inter-American Court of Human Rights,+506,,San José,https://corteidh.or.cr/index.cfm?lang=en,,
CostaRica: volcán Poás lanza ceniza a más de 3 km de altura,,,San José,https://www.dw.com/es/costa-rica-volcán-poás-arroja-ceniza-a-más-de-3-km-de-altura/a-72305016,,
CostaRicaTours for Singles,,,San José,https://www.loveme.com/tour/costa-rica/,,
"Vivero Rio Frio: Vivero Productor de Plantas Ornamentales, Mayoreo y ...",,,Heredia,https://www.viveroriofrio.com/,,
"ViveroEl Zamorano -Heredia,CostaRica| Construinforme.com",+506,,Heredia,https://construinforme.com/ci/provider_anonview.php?PROODIVER_ID=1637,,
ViverosBaratos EnHeredia| TikTok,,,Heredia,https://www.tiktok.com/discover/viveros-baratos-en-heredia,,
"10 lugares que debes conocer en la provincia deHeredia,CostaRica",,,Heredia,https://www.urbanocotidiano.com/10-lugares-que-debes-conocer-en-la-provincia-de-heredia-costa-rica/,,
Sexi vendedor de pastoras enHerediaenloquece a cientos...,,,Heredia,https://www.lateja.cr/farandula/sexi-vendedor-de-pastoras-en-heredia-enloquece-a/DB7JZ7IL2VGL7LKKNFZAXJNWGA/story/,,
Encuentra y guarda ideas sobreherediacostaricaen Pinterest.,,,Heredia,https://es.pinterest.com/ideas/heredia-costa-rica/903697226967/,,
viverosde árboles frutales encostarica,+506,viveroguacolda@gmail.com,Heredia,http://informacionestadistica.uagro.mx/inicio/images/xwwjrag/article.php?1c2f68=viveros-de-árboles-frutales-en-costa-rica,,"info@viverosrequinoa.cl, vibonita@ice.co.cr"
"Casa (90.0 m²) en alquiler en Barva (Barva,Heredia,CostaRica)",,,Heredia,https://rentola.cr/listings/casa-en-barva-heredia-house-for-daily-or-monthly-rent-in-costa-rica-pffc9ac,,
Los 10 lugares más románticos deCostaRicapara declarar tu amor,+506,,Heredia,https://matadornetwork.com/es/lugares-mas-romanticos-de-costa-rica-para-declarar-tu-amor/,,
"El clima enHeredia, el tiempo por mes, temperatura promedio (Costa...)",,,Heredia,https://es.weatherspark.com/y/15525/Clima-promedio-en-Heredia-Costa-Rica-durante-todo-el-año,,
Opiniones sobreHerediaCostaRicaForo de Centroamérica...,,,Heredia,https://www.losviajeros.com/foros.php?sm=Heredia-Costa-Rica&sf=24,,
Viveros y suministros de jardinería en Heredia (Costa Rica),,,Heredia,https://es.cybo.com/CR/heredia-(costa-rica)/viveros-y-suministros-de-jardinería/,,
Explorar organizaciones sin fines de lucro en Costa Rica,,admin@amigosofcostarica.org,Heredia,https://es.amigosofcostarica.org/affiliates,,
Historical institutionalism in comparative politics,+506,,Heredia,https://repositorio-digital.cide.edu/handle/11651/6350,,
Vivero La Reina S.A #3,,,Cartago,https://www.todosbiz.com/CR/vivero-la-reina-s-a_1c-2530-1742,,
Viveros y suministros de jardinería en Cartago (Costa Rica),,,Cartago,https://es.cybo.com/CR/cartago-(costa-rica)/viveros-y-suministros-de-jardinería/,,
VIVERO EXOTICA,,,Cartago,https://cr.eldirectorio.co/empresas/cartago/viveros/vivero-exotica-2461,,
Semillas Plantae,,ejemplo@domain.com,Cartago,https://semillasplantae.com/,,
"Flores Volcán, Costa Rica",+506,info@floresvolcan.com,Cartago,https://floresvolcan.com/es/,,
Welcome to the farm!,,,Cartago,https://www.fincalaflor.org/,,
Community,+506,ugacrheadnaturalist@gmail.com,Cartago,https://ugacostarica.wordpress.com/category/community/,,
Casa Firefly Boutique Costa Rica,,,Cartago,https://www.tiktok.com/discover/casa-firefly-boutique-costa-rica,,
Descubre elviveroideal en Tejar deCartago| TikTok,,,Cartago,https://www.tiktok.com/@galaxymuse_/video/7510429697193332024,,
Encuentra y guarda ideas sobrecartagocostaricaen Pinterest.,,,Cartago,https://es.pinterest.com/ideas/cartago-costa-rica/928014563398/,,
3PlantSpecies to be Wary of on Your NextCostaRican Vacation,+506,info@cbpacificrealty.com,Cartago,https://cbpacificrealty.com/article/3-plant-species-to-be-wary-of-on-your-next-costa-rican-vacation,,
"Limón toCartago- 4 ways to travel via plane, bus, and car",,,Cartago,https://www.rome2rio.com/s/Limón/Cartago-Costa-Rica,,
Los JardinesViveroy Café,,,Alajuela,https://viajerotico.com/destinos/131-los-jardines-vivero-y-cafe,,
ViverosArboles FrutalesCostaRica,,,Alajuela,https://misjardines.com/arboles-frutales/viveros-arboles-frutales-costa-rica/,,
Encuentra y guarda ideas sobrealajuelacostaricaen Pinterest.,,,Alajuela,https://es.pinterest.com/ideas/alajuela-costa-rica/915668239694/,,
CostaRicatime now.CostaRicatime zone and map with current time...,,,Alajuela,https://www.timeanddate.com/worldclock/costa-rica,,
"Electron Beam & Ethylene Oxide Sterilization -Alajuela,CostaRica",,ast_info@steris.com,Alajuela,https://www.steris-ast.com/our-locations/alajuela-costa-rica,,
Árboles de Mamón Chino Listos para Tu Jardín,,,Alajuela,https://www.tiktok.com/@upalaverde/video/7551960201193196812,,
Contact,+506,itech@itechelpaso.com,Alajuela,https://www.itechelpaso.com/contacto,,"kopar@kopar.com.mx, itech@kopar.com.mx"
Guanacaste Water Center 1,+506,guanacastewatercenter@gmail.com,Guanacaste,https://www.guanacastewatercenter.org/es/pages/guanacaste-water-center-1,,
Teléfonos en Costa Rica Buscar Teléfono Celular,,,Guanacaste,https://registronacional.com/costarica/telefonos.htm,,
